{
  "caseId": "D01",
  "sourceSha": "f5fa6064761d4fcaf5c66214f3dbba4183ae03d5",
  "appVersion": "v5.113",
  "apkSha256": null,
  "deviceModel": null,
  "api": null,
  "surface": "NOT_OBSERVED",
  "attemptAlias": null,
  "recognitionFinality": "NOT_OBSERVED",
  "candidateCount": null,
  "candidateRank": null,
  "gradingResult": "NOT_OBSERVED",
  "uiResult": "NOT_OBSERVED",
  "srsWriteCount": null,
  "studyLogResult": "NOT_OBSERVED",
  "result": "NOT_RUN",
  "triage": "NOT_OBSERVED",
  "evidenceLocation": null,
  "subtrialId": "primary",
  "requestedCount": null,
  "availableCount": null,
  "startedCount": null,
  "shortfallCount": null,
  "viewportWidth": null,
  "viewportHeight": null,
  "webViewVersion": null,
  "chromeVersion": null,
  "orientation": "NOT_OBSERVED",
  "microphonePermission": "NOT_OBSERVED",
  "network": "NOT_OBSERVED",
  "completionState": "NOT_OBSERVED",
  "recognitionComplete": null
}
